{"id":"Archipelago","name":"Archipelago","maxPlayers":2,"maxUnitsPerPlayer":100,"cameraBounds":{"cx":0.0,"cy":9.5,"sx":20.0,"sy":13.0},"terrain":{"gridWidth":64,"gridHeight":64,"cells":[4,4,4,4,4,4,4,4,4,4,4,4,4,4,4,4,4,4,4,4,4,4,4,4,4,4,4,4,4,4,4,4,4,4,4,3,3,3,3,4,4,4,4,4,4,4,4,4,4,4,4,4,4,4,6,6,1,1,1,1,1,1,1,1,4,4,4,4,4,4,4,4,4,4,4,4,4,4,4,4,4,4,4,4,4,4,4,4,4,4,4,4,4,4,4,4,4,4,4,4,3,3,3,4,4,4,4,4,4,4,4,4,4,4,4,4,4,4,6,6,1,1,1,1,1,1,1,1,4,4,4,4,4,4,4,4,4,4,4,4,4,4,4,4,4,4,4,4,4,4,4,4,4,4,4,4,4,4,4,4,4,4,4,4,3,3,3,4,4,4,4,4,4,2,2,2,4,4,4,4,4,4,6,1,1,1,1,1,1,1,1,1,4,4,4,4,4,4,4,4,4,4,4,4,4,4,4,4,4,4,4,4,4,4,4,4,4,4,4,6,6,6,4,4,4,4,4,4,3,3,4,4,4,4,4,4,2,2,3,2,4,4,4,4,4,6,1,1,1,1,1,1,1,1,1,1,4,4,4,4,4,4,4,4,4,4,4,4,4,4,4,4,4,4,4,4,4,4,4,4,4,4,4,6,6,6,6,4,4,4,4,4,3,3,4,4,4,4,4,4,2,3,3,2,2,2,2,4,4,6,1,1,1,1,1,1,1,1,1,1,4,4,4,4,4,4,4,4,4,4,4,4,4,4,4,4,4,4,4,4,4,4,4,4,4,4,6,6,6,6,6,4,6,6,4,4,3,3,4,4,6,6,4,4,2,3,3,3,3,2,2,4,6,6,1,1,1,1,1,1,1,1,1,1,4,4,4,4,4,4,4,4,4,4,4,4,4,4,4,4,4,4,4,4,4,4,4,4,4,4,4,6,6,6,4,4,6,6,4,4,4,4,4,4,6,6,6,4,2,2,3,3,3,2,2,4,6,6,1,1,1,1,1,1,1,1,1,1,4,4,4,4,4,4,4,4,4,4,4,4,4,4,4,4,4,4,4,4,4,4,4,4,4,4,4,4,4,4,4,4,4,4,4,2,2,2,2,4,6,6,6,4,4,2,3,3,2,2,2,4,6,1,1,1,1,1,1,1,1,1,1,1,4,4,4,4,4,4,4,4,4,4,4,4,4,4,4,4,4,4,4,4,4,6,6,6,6,6,6,4,4,4,4,4,4,4,2,2,3,3,2,4,4,4,4,4,4,2,2,2,2,2,4,4,6,1,1,1,1,1,1,1,1,1,1,1,4,4,4,4,4,4,4,4,4,4,4,4,4,4,4,4,4,4,4,6,6,6,1,1,1,6,6,4,6,6,6,6,6,4,2,3,3,2,2,4,4,4,4,4,4,4,2,2,4,4,4,4,6,1,1,1,1,1,1,1,1,1,1,2,6,4,4,4,4,4,4,4,4,4,4,4,4,4,4,4,4,4,6,6,1,1,1,1,1,6,6,4,6,1,1,1,6,4,2,3,3,2,2,4,4,4,4,4,4,4,2,2,4,4,4,6,6,1,1,1,1,1,1,1,1,2,2,2,1,6,6,4,6,6,6,6,6,6,6,6,4,4,4,4,4,4,6,1,1,1,1,1,6,6,6,4,6,1,1,1,6,4,2,3,2,2,2,4,4,4,4,4,4,4,4,4,4,3,3,3,3,3,1,1,1,1,2,2,2,2,2,2,1,6,6,4,6,1,1,1,1,1,1,6,4,4,4,4,4,4,6,1,1,1,6,6,4,4,4,4,6,1,1,1,6,4,2,2,2,4,4,4,4,4,4,4,4,4,4,4,4,4,3,3,3,3,2,1,2,2,2,2,3,3,3,3,1,6,6,6,6,1,1,1,1,1,6,6,4,4,4,6,4,4,6,6,6,6,6,4,4,4,4,4,6,1,1,1,6,4,4,4,4,4,4,4,4,4,4,4,4,4,4,4,4,4,3,3,3,2,2,2,2,2,2,3,3,3,3,3,1,6,4,6,1,1,1,1,1,1,6,4,4,4,6,6,6,4,4,4,6,6,4,4,4,4,4,4,6,6,1,1,6,4,4,4,6,6,6,6,4,4,4,4,4,4,4,4,4,4,3,3,2,2,2,2,2,2,3,3,3,3,3,3,1,6,4,6,1,1,1,1,1,6,6,4,4,6,6,1,6,6,4,4,4,4,4,4,4,4,4,4,4,6,6,1,6,4,4,6,6,1,1,6,4,4,6,6,6,6,4,4,6,6,2,2,2,2,2,2,2,3,3,3,3,3,3,3,1,6,4,6,6,1,1,1,1,6,4,4,6,6,1,1,1,6,4,4,4,4,4,6,6,6,6,6,4,4,6,6,6,4,6,6,1,1,1,6,6,4,6,6,6,6,4,4,6,1,2,2,2,2,2,2,3,3,3,3,3,3,3,3,1,6,4,4,6,1,1,6,6,4,4,6,6,1,1,1,1,6,6,4,4,4,4,6,1,1,1,6,4,4,4,4,4,4,6,1,1,1,1,1,6,4,6,6,6,4,4,6,6,1,1,2,2,2,2,2,3,3,3,3,3,3,3,7,6,6,4,4,6,6,6,6,4,4,6,6,1,1,1,1,1,1,6,4,4,4,4,6,1,1,1,6,4,4,4,4,4,4,6,1,1,1,1,6,4,4,6,4,4,4,6,6,1,1,1,1,1,1,2,2,3,3,3,3,7,7,7,7,4,4,4,4,6,6,4,4,4,4,6,1,1,1,1,1,1,1,6,4,4,4,4,6,1,1,1,6,4,4,4,4,4,4,6,1,1,1,1,6,4,4,4,4,4,4,6,1,1,1,1,1,1,1,2,2,3,3,3,3,7,7,7,7,4,4,4,4,4,4,4,4,4,6,6,1,1,1,1,1,1,1,6,4,4,4,4,6,6,1,1,6,4,4,4,4,4,4,6,1,1,1,1,6,4,4,4,4,6,6,1,1,1,1,1,1,1,1,2,3,3,3,3,3,7,7,7,7,4,4,4,4,4,4,4,4,6,6,1,1,1,1,1,1,1,6,6,4,4,4,4,4,6,6,1,6,4,4,4,4,4,4,6,1,1,1,6,6,4,4,4,4,6,6,1,1,1,1,1,1,1,1,2,2,3,3,3,3,7,7,7,7,4,4,6,6,6,6,6,6,6,1,1,1,1,1,1,1,1,6,4,4,4,4,4,4,4,6,6,6,4,4,4,4,4,4,4,6,6,6,6,4,4,4,4,4,6,1,1,1,1,1,1,1,1,1,2,2,3,3,3,3,3,7,7,7,4,4,6,6,6,6,6,6,1,1,1,1,1,1,1,1,6,4,4,4,4,6,6,4,4,4,6,6,4,4,4,4,4,4,4,4,4,4,4,4,4,4,4,4,6,1,1,1,1,1,1,1,1,1,2,2,2,3,3,3,3,7,7,7,4,6,6,1,6,6,1,1,1,1,1,1,1,1,1,6,6,4,4,4,6,6,1,6,4,4,6,4,4,4,4,6,4,4,4,4,4,4,4,4,4,6,4,4,6,1,1,1,1,1,1,1,1,1,2,2,2,3,3,3,3,3,7,7,4,6,6,1,1,1,1,1,1,1,1,1,1,1,1,6,4,4,4,4,6,1,1,1,6,4,4,4,4,4,6,6,4,4,4,4,4,4,6,6,6,6,4,4,6,1,1,1,1,1,1,1,1,1,2,2,2,3,3,3,3,3,3,7,4,6,6,1,1,1,1,1,1,1,1,1,1,1,1,6,4,4,4,6,6,1,1,1,6,6,4,4,4,6,6,1,6,4,4,4,4,6,6,1,1,6,4,4,6,1,1,1,1,1,1,1,1,1,1,2,2,3,3,3,3,3,3,7,4,6,1,1,1,1,1,1,1,1,1,1,1,1,1,6,4,4,6,6,1,1,1,1,1,6,4,4,4,6,1,1,6,4,4,4,4,6,6,1,1,6,4,4,6,1,1,1,1,1,1,1,1,1,1,1,2,2,3,3,3,3,3,3,4,6,1,1,1,1,1,1,1,1,1,1,1,1,1,6,4,4,6,1,1,1,1,1,1,6,4,4,6,1,1,1,6,4,4,4,4,6,6,1,1,6,4,4,6,1,1,1,1,1,1,1,1,1,1,1,1,2,2,2,3,3,3,3,4,6,1,1,1,1,1,1,1,1,1,1,1,1,6,6,4,4,6,1,1,1,1,3,1,6,4,4,6,1,1,1,6,6,4,4,4,6,1,1,1,6,4,4,6,1,1,1,1,1,1,1,1,1,1,1,1,1,2,2,3,3,3,3,4,6,1,1,1,1,1,1,1,1,1,1,1,1,6,4,4,4,6,1,1,1,1,1,1,6,4,4,6,1,1,1,1,6,4,4,6,6,1,1,1,6,4,4,6,1,1,1,1,1,1,1,1,1,1,1,1,1,2,2,2,3,3,3,4,6,1,1,1,1,1,1,1,1,1,1,1,1,6,4,4,4,6,1,1,1,1,1,1,6,4,4,6,1,1,1,1,6,4,4,6,6,1,1,1,6,6,4,6,1,1,1,1,1,1,1,1,1,1,1,1,1,2,2,2,2,2,3,4,6,1,1,1,1,1,1,1,1,1,1,1,6,6,4,4,6,6,1,1,1,1,1,6,6,4,4,6,1,1,1,1,6,4,4,6,6,6,1,1,1,6,4,6,1,1,1,1,1,1,1,1,1,1,1,1,1,2,2,2,2,2,2,4,6,1,1,1,1,1,1,1,1,1,1,1,6,6,4,4,6,1,1,1,1,1,1,6,6,4,4,6,1,1,1,1,6,4,4,6,6,6,1,1,1,6,4,6,6,1,1,1,1,1,1,1,1,1,1,1,2,2,2,1,1,2,2,4,6,6,1,1,1,1,1,1,1,1,1,1,6,6,4,4,6,1,1,1,1,1,1,6,4,4,4,6,1,1,1,6,6,4,4,6,6,1,1,1,1,6,4,6,6,1,1,1,1,1,1,1,1,1,1,2,2,2,1,1,1,1,1,4,4,6,6,1,1,1,1,1,1,1,1,1,6,4,4,4,6,1,1,1,1,1,6,6,4,4,4,6,1,1,1,6,4,4,4,4,6,1,1,1,6,6,4,4,6,6,1,1,1,2,2,2,2,2,2,2,2,2,1,1,1,1,1,4,4,4,6,6,1,1,1,1,1,1,1,1,6,4,4,6,6,1,1,1,1,1,6,4,4,4,4,6,1,1,1,6,4,4,4,4,6,1,1,1,6,4,4,4,4,6,6,6,2,2,2,2,2,2,2,2,2,2,1,1,1,1,1,4,4,4,4,6,6,6,1,1,1,1,1,1,6,4,4,6,6,1,1,1,1,6,6,4,4,4,4,6,6,1,6,6,4,4,4,4,6,1,1,1,6,4,4,4,4,4,6,6,6,2,3,3,3,2,2,3,2,1,1,1,1,1,1,4,4,4,4,4,6,6,6,1,1,1,1,6,6,4,4,6,1,1,1,1,1,6,4,4,4,4,4,4,6,6,6,4,4,4,4,6,6,1,1,1,6,4,4,4,4,4,4,6,6,3,3,3,3,3,3,3,1,1,1,1,1,1,1,4,4,4,4,4,4,4,6,6,6,6,1,6,6,4,4,6,1,1,1,1,1,6,4,4,4,6,6,4,4,6,4,4,4,4,4,6,6,6,6,6,6,4,4,6,6,6,4,4,4,3,3,3,3,3,3,1,1,1,1,1,1,1,1,4,4,4,6,6,4,4,4,4,6,6,6,6,6,4,4,6,1,1,1,1,6,6,4,4,4,6,6,6,4,4,4,4,4,4,4,4,4,4,4,4,4,4,4,6,2,2,6,6,4,3,3,3,3,3,3,1,1,1,1,1,1,1,1,4,4,4,6,6,6,6,4,4,4,4,6,6,6,4,4,6,1,1,6,6,6,4,4,4,4,6,6,6,4,4,4,4,4,4,4,4,4,4,4,4,4,4,4,6,2,2,2,6,4,3,3,3,3,3,3,1,1,1,1,1,1,1,1,4,4,6,6,1,6,6,6,4,4,4,4,4,6,4,4,6,1,1,1,6,4,4,4,4,4,4,4,4,4,6,6,6,6,6,6,6,6,4,4,4,4,4,4,6,2,3,2,6,4,3,3,3,3,3,1,1,1,1,1,1,1,1,1,4,4,6,1,1,1,6,6,6,4,4,4,4,4,4,4,6,6,6,6,4,4,4,6,6,6,6,4,4,4,6,6,6,6,6,6,6,6,4,4,4,4,4,4,6,2,3,2,6,4,4,3,3,3,1,1,1,1,1,1,1,1,1,1,4,6,6,1,1,1,1,1,6,6,6,4,4,4,4,4,4,4,4,4,4,4,6,6,1,1,6,6,4,4,6,6,6,6,6,6,6,6,6,4,4,4,4,4,6,2,2,2,6,4,4,4,6,1,1,1,1,1,1,1,1,1,1,1,4,6,6,1,1,1,1,1,1,6,6,4,4,4,4,4,4,4,4,4,4,4,6,1,1,1,1,6,4,4,6,6,6,6,6,6,6,6,6,6,4,4,4,4,4,6,6,6,6,4,4,4,6,1,1,1,1,1,1,1,1,1,1,1,4,6,1,1,1,1,1,1,1,1,6,6,4,4,4,4,4,4,4,4,4,4,6,1,1,1,1,6,4,4,6,6,6,6,6,6,6,6,6,6,4,4,4,4,4,4,4,4,4,4,4,4,6,1,1,1,1,1,1,1,1,1,1,1,4,6,1,1,1,1,1,1,1,1,1,6,4,4,4,4,4,4,4,4,4,4,6,1,1,1,1,6,4,4,4,4,4,6,6,6,6,6,6,6,4,4,4,4,4,4,4,4,4,4,4,4,6,1,1,1,1,1,1,1,1,1,1,1,4,6,1,1,1,1,1,1,1,1,6,6,4,4,4,4,4,4,4,4,4,4,6,6,6,6,6,6,4,4,4,4,4,6,6,6,6,6,6,6,4,4,4,4,4,4,4,4,6,6,6,4,6,6,1,1,1,1,1,1,1,1,1,1,4,6,1,1,1,1,1,1,1,6,6,4,4,4,4,4,4,4,4,4,4,4,4,6,6,6,6,6,4,4,4,4,4,4,4,4,4,4,4,4,4,4,6,6,6,6,4,6,6,1,6,6,4,6,1,1,1,1,1,1,1,1,1,1,4,6,6,1,1,1,1,1,1,6,4,4,4,4,4,4,4,4,4,4,4,4,4,4,4,4,4,4,4,4,6,6,6,6,4,4,4,4,4,4,4,4,6,1,1,6,4,6,1,1,1,6,4,6,1,1,1,1,1,1,1,1,1,1,4,6,6,1,1,1,1,1,6,6,4,4,4,4,4,4,4,4,4,4,4,4,4,4,4,4,4,4,4,4,6,1,1,6,6,6,4,4,4,4,4,4,6,1,6,6,4,6,1,1,6,6,4,6,1,1,1,1,1,1,1,1,1,1,4,4,6,1,1,1,1,1,6,4,4,4,4,4,4,4,4,4,4,4,4,4,4,4,4,4,4,4,4,4,6,1,1,1,1,6,4,4,6,6,6,4,6,6,6,4,4,6,6,6,6,4,4,6,1,1,1,1,1,1,1,1,1,1,4,4,6,1,1,1,1,1,6,4,4,4,4,4,4,4,4,4,4,4,4,4,4,4,4,4,4,4,4,4,6,6,1,1,1,6,4,4,6,6,6,4,4,4,4,4,4,6,4,4,4,4,4,6,1,1,1,1,1,1,1,1,1,1,4,4,6,1,1,1,1,1,6,4,4,4,4,4,4,4,4,4,4,4,4,4,4,4,4,4,4,4,4,4,4,6,6,1,6,6,4,4,6,6,6,6,4,4,4,6,4,4,4,4,4,4,4,6,1,1,1,1,1,1,1,1,1,1,4,4,6,6,1,1,1,6,6,4,4,4,4,4,4,4,4,4,4,4,4,4,4,4,4,4,4,4,4,4,4,4,6,6,6,4,4,4,4,4,6,6,6,4,6,6,6,4,4,4,4,4,4,6,6,1,1,1,1,1,1,1,1,1,4,4,6,6,6,6,6,6,4,4,4,4,4,4,4,4,4,4,4,4,4,4,4,4,4,4,4,4,4,4,4,4,4,4,4,4,4,4,4,4,4,4,4,4,6,6,6,4,4,4,4,4,4,4,6,6,1,1,1,1,1,1,1,1,4,4,4,4,6,6,6,4,4,4,4,4,4,4,4,4,4,4,4,4,4,4,4,4,4,4,4,4,4,4,4,4,4,4,4,4,4,4,4,4,4,4,4,4,4,4,4,4,4,6,6,4,4,4,4,6,6,1,1,1,1,1,1,1,4,4,4,4,4,4,4,4,4,4,4,4,4,4,4,4,4,4,4,4,4,4,4,4,4,4,4,4,4,4,4,4,4,4,4,4,4,4,4,4,4,4,4,4,4,4,4,6,6,6,6,6,4,4,4,4,6,6,1,1,1,1,1,1,4,4,4,4,4,4,4,4,4,4,4,4,4,4,4,4,4,4,4,4,4,4,4,4,4,4,4,4,4,4,4,4,4,4,4,4,4,4,4,4,4,4,4,4,4,4,4,6,1,1,1,6,4,4,4,4,4,6,6,6,1,1,1,1,4,4,4,4,4,4,4,4,4,4,4,4,4,4,4,4,4,4,4,4,4,4,4,4,4,4,4,4,4,4,4,4,4,4,4,4,4,4,4,4,4,4,4,4,4,4,4,4,6,6,6,6,4,4,4,4,4,4,4,6,6,1,1,1,4,4,4,4,4,4,4,4,4,4,4,4,4,4,4,4,4,4,4,4,4,4,4,4,4,4,4,4,4,4,4,4,4,4,4,4,4,4,4,4,4,4,4,4,4,4,4,4,4,4,4,4,4,4,4,4,4,4,4,4,6,6,6,6,4,4,4,4,4,4,4,4,4,4,4,4,4,4,4,4,4,4,4,4,4,4,4,4,4,4,4,4,4,4,4,4,4,4,4,4,4,4,4,4,4,4,4,4,4,4,4,4,4,4,4,4,4,4,4,4,4,4,4,4,4,4,4,4,4,4,4,4,4,4,4,4,4,4,4,4,4,4,4,4,4,4,4,4,4,4,4,4,4,4,4,4,4,4,4,4,4,4,4,4,4,4,4,4,4,4,4,4,4,4,4,4,4,4,4,4,4,4,4,4,4,4,4,4,4,4,4,4],"trees":[{"x":-8.992329597473145,"y":8.304691314697266,"variant":9,"scale":1.0930910110473633,"flipX":false},{"x":-5.87201452255249,"y":7.0458550453186039,"variant":3,"scale":0.9556810855865479,"flipX":false},{"x":-5.6219401359558109,"y":7.9532246589660648,"variant":9,"scale":0.9380613565444946,"flipX":false},{"x":-6.184324741363525,"y":8.618422508239746,"variant":4,"scale":1.1216424703598023,"flipX":false},{"x":-6.979372501373291,"y":8.017417907714844,"variant":8,"scale":0.9560695886611939,"flipX":false},{"x":-8.144970893859864,"y":8.127433776855469,"variant":3,"scale":0.9387170076370239,"flipX":false},{"x":-6.437122344970703,"y":7.809450149536133,"variant":4,"scale":0.8561527729034424,"flipX":false},{"x":-5.348374366760254,"y":7.578216552734375,"variant":9,"scale":0.9944416284561157,"flipX":false},{"x":-5.920644283294678,"y":7.290960788726807,"variant":4,"scale":1.0831990242004395,"flipX":false},{"x":-7.010317802429199,"y":7.921096324920654,"variant":7,"scale":0.8815615177154541,"flipX":false},{"x":-6.720174312591553,"y":8.056439399719239,"variant":6,"scale":0.8775947093963623,"flipX":false},{"x":-4.8584442138671879,"y":6.5542449951171879,"variant":7,"scale":0.9041475057601929,"flipX":false},{"x":-5.845515251159668,"y":9.34976577758789,"variant":3,"scale":0.9495565891265869,"flipX":false},{"x":-6.016546249389648,"y":8.589178085327149,"variant":4,"scale":0.8690329790115356,"flipX":false},{"x":-5.258709907531738,"y":7.525551795959473,"variant":7,"scale":0.9561135768890381,"flipX":false},{"x":-6.740847110748291,"y":9.115288734436036,"variant":8,"scale":0.9004335403442383,"flipX":false},{"x":-5.6